IDs,title,fol_or_p
BR_1574_III_n07,Ein fauler Baum verholen ist gar ferne inn grúnner Awe (Ein fauer Baum verhohlen),Biiij
BR_1574_III_n08,Wach auff meins Hertzen ein schóne zart aller liebste mein (Wach auf meins Herzen ein Schöne Zartallerliebste),Bv
BR_1574_III_n09,Seyt fromb vnnd frólich alle auff Marienberge (Seid fromm und fröhlich alle auf Marienberge),
BR_1574_III_n10,Was wóllen wir aber singen wir singen ein new gedicht von new geschehen dingen (Was wollen wir aber singen ein neues Gedicht),"C, Cij"
BR_1574_III_n11,Wolauff jhr gutten Gesellen auff Sanct Annabergk (Wohlauf ihr guten Gesellen auf St. Annaberg),"Ciij, Ciiij"
BR_1574_III_n12,Es was einmal ein Reicher Man (Es war einmal ein reicher Mann),Cv
BR_1574_III_n13,Ade Ade Ade Gott gesegne dich mein feines lieb (Ade Ade Ade Gott segne dich mein feines Lieb),
BR_1574_III_n14,Warumb sol ich sie meiden (Warum soll ich sie meiden),
BR_1574_III_n15,Ich hab gehórt von Gottes Wort Das gefelt mir wol (Ich habe gehört von Gottes Wort),
BR_1574_II_n00,Ander Teyl der Bergkreyen Auffs new zusamen bacht [...] (Der andere Teil der Bergreihen),
BR_1574_II_n01,Sie ist meins gemúts ein trósterin (Sie ist meines Gemüts eine Trösterin),Aij
BR_1574_II_n02,Woll kompt der May (Wohl kommt der Mai),2
BR_1574_II_n03,Ich sach mir vor jenem Walde (Ich sah mir vor jenem Wald),Aiij
BR_1574_II_n04,Mich zwingt dar zú das ich kein rhu (Mich zwingt dazu dass ich keine Ruhe),Aiij
BR_1574_II_n05,Ich erfrew mich eins des ich mich billich (Ich erfreue mich Eines des ich mich billig),Aiiij
BR_1574_II_n06,Viel glúck vnd heyl ist niemandts feyl (Viel Glück und Heil ist niemands feil),Aiiij
BR_1574_II_n07,Wolauff jr Narren ziehet all mit mir (Wohlauf ihr Narren ziehet alle mit mir),Av
BR_1574_II_n08,Ich klag und schrey mein schwere pein (Ich klage und schreie meine schwere Pein),Av
BR_1574_II_n09,Es reyt ein Herr vnd auch sein knecht (Es ritt ein Herr und auch sein Knecht),9
BR_1574_II_n10,Ein Weiblich bildt mich anesicht (Ein weibliches Bild mich ansieht),10
BR_1574_II_n11,Hab mir mein hertz zu friden gestelt (Hab mir mein Herz zufrieden gestellt),11
BR_1574_II_n12,Es ritt ein Herr mit seim Knecht an des morgens (Es ritt ein Herr mit seinem Knecht an des Morgens),12
BR_1574_II_n13,Ich weiß mir ein meidlein húbsch vnd fein (Ich weiß mir ein Maidlein hübsch und fein),13
BR_1574_II_n14,Wer ich ein wilder Falcke (Wäre ich ein wilder Falke),B
BR_1574_II_n15,So will ich frisch vund frólich sein ich hoff (So will ich frisch und fröhlich sein),"B, Bij"
BR_1574_II_n16,So wúnsch ich jr ein gute nacht (So wünsche ich Ihr eine gute Nacht),Bij
BR_1574_II_n17,Nun lob mein seel den herrn vnd was in mir ist (Nun lobe meine Seeele den Herrn),17
BR_1574_II_n18,Man singet von schónen Frewlein viel (Man singt von schönen Fräulein viel),18
BR_1574_II_n19,Frisch auff in Gottes namen du werde teutsche Nation (Frisch auf in Gottes Namen),Biiij
BR_1574_II_n20,Ewiger Vatter im Himelreich der du regierest (Ewiger Vater im Himmelreich),Bv
BR_1574_II_n21,Frólich so wil ich singen ein schóne Tageweiß (Fröhlich so will ich singen eine schöne Tageweise),C
BR_1574_II_n22,Frólich so will ich singen jetzund zu diser Frist (Fröhlich will ich singen jetzt zu dieser Frist),"Cij, Ciij, Ciiij"
BR_1574_II_n23,Gott lob vor allen dingen frólich wir heben an (Gott Lob vor allen Dingen fröhlich heben wir an),Cv
BR_1574_II_n24,Gott grúß euch zart Junckfrewelein (Gott grüße euch zartes Jungfräulein),24
BR_1574_II_n25,Erzúrn dich nit O frommer Christ vorm Neid (Erzürne dich nicht o frommer Christ),"D, Dij"
BR_1574_II_n26,Nur Nerrisch sein ist mein manier (Nur närrisch sein ist meine Manier),"Dij, Diij"
BR_1574_II_n27,Der genaden Brun thut fliessen den soll man trincken (Der Gnaden Brunnen tut fließen),Diiij
BR_1574_II_n28,Gott will dem woll der haben will (Gott will dem wohl der haben will),"Diiij, Dv"
BR_1574_II_n29,Daniel der Prophet beschreib von einem reinen (Daniel der Prophet beschrieb),29
BR_1574_II_n30,Brauns Meydlein zeuch dein Hemmetlein ab (Braunes Maidlein zieh dein Hemdlein ab),30
BR_1574_I_n00,Bergkreyen Etliche Schóne gesenge newlich zúsamen gebracht gemehret vnd gebessert (Bergreihen Etliche schöne Gesänge neulich zusammen gebracht [...]),
BR_1574_I_n01,Ach Gott von Himelreiche durch Christum deinen Son (Ach Got von Himmelreich durch Christum deinen Sohn),Aij
BR_1574_I_n02,Ach herre gott kúnd ich auß meines hertzen grund gewinnen (Ach Herr Gott könnte ich aus meines Herzens Grund gewinnen),Aiij
BR_1574_I_n03,Aude Ach mir liebet ein Bildt inn eytel Blawer farb (Ade ach mir liebt ein Bild in eitler blauer Farbe),Aiij
BR_1574_I_n04,Der sommer fert vns von hinnen (Der Sommer fährt uns von hinnen),Aiiij
BR_1574_I_n05,Die Faßnacht bringt vnns frewden zwar (Die Fastnacht bringt uns Freuden zwar),Av
BR_1574_I_n06,Ein Múhl die ich euch bawen will (Eine Mühle und die ich euch bauen will),Av
BR_1574_I_n07,Ein Thurnier sich erhaben hat (Ein Turnier sich erhaben hat),7
BR_1574_I_n08,Es reist ein thumb in grosser summ (Es reist ein Thum in großer Summe),8
BR_1574_I_n09,Er ist der morgensterne (Er ist der Morgenstern),9
BR_1574_I_n10,Es solt ein Meindlein frúh auffstan (Es sollte ein Maidlein früh auf stehn),10
BR_1574_I_n11,Eins mals ritt ich des Winters kalt (Einstmals ritt ich des Winters kalt),11
BR_1574_I_n12,Frólich wil ich singen (Fröhlich will ich singen),B
BR_1574_I_n13,Furwitz der Kramer hatt vil war gebracht (Fürwitz der Krämer hat viel Ware gebracht aus fremden Landen),Bij
BR_1574_I_n14,"Gib hilff vnd rath mein außerwelte Fraw (Gib Hilfe, gib Rat, meine auserwählte Frau)",Biij
BR_1574_I_n15,Groß lieb hatt mich vmbfangen (Große Liebe hat mich umfangen),Biij
BR_1574_I_n16,Grob Hut macht man vorzeiten (Grobe Hüte machte man vor Zeiten),Biiij
BR_1574_I_n17,Hilff Gott das mir gelinge du edler schópfer mein (Hilf Gott dass mir gelinge du edler Schöpfer mein),17
BR_1574_I_n18,In Gottes namen heben mir an (In Gottes Namen heben wir an),18
BR_1574_I_n19,In Jesus namen heben wir an (In Jesus Namen heben wir an),19
BR_1574_I_n20,Ich sahe mir den Meyen mit roten Róßlein (Ich sah mir den Mai mit roten Röslein),20
BR_1574_I_n21,Ich hett mich vnterwunden gegen einer die ist hochgemelt (Ich hatte mich unterwunden gegen einer die ist hochgemeldet),C
BR_1574_I_n22,Jungfraw du thust mich drucken (Jungfrau du thust mich drücken),C
BR_1574_I_n23,Ich bin verirrt das klag ich Gott (Ich bin verirrt das klage ich Gott),23
BR_1574_I_n24,Ich weiß das hóflichste Berckwerck (Ich weiß das höflichste Bergwerk),Cij
BR_1574_I_n25,Ich stundt ahn einem morgen (Ich stand an einem Morgen),Ciij
BR_1574_I_n26,Lobt Gott jr frommen Christen (Lobt Gott ihr frommen Christen),"Ciij, Ciiij"
BR_1574_I_n27,Lieblich hat sich gesellet mein hertz in kurtzer frist (Lieblich hat sich gesellt mein Herz in kurzer Frist),Ciiij
BR_1574_I_n28,Mich erfrewet schónes lieb dein aneplick (Mich erfreut schönes Lieb dein Anblick),Cv
BR_1574_I_n29,Nach wollust meines hertzen will ich heben an (Nach Wollust meines Herzens will ich heben an),Cv
BR_1574_I_n30,O Gott in Trinitate wer kan volloben dich (O Gott in Trinitate wer kann vollloben dich),30
BR_1574_I_n31,Schaff ich mir vnfals kummers vil (Schaffe ich mir Unfalls Kummers viel),13
BR_1574_I_n32,Venus gib vns weise lehre (Venus gib uns weise Lehre),32
BR_1574_I_n33,Wiewol ich sag mein Himelreich auff Erden (Wiewohl ich sah mein Himmelreich auf Erden),33
BR_1574_I_n34,Wollust in dem Mayen die zeit hat freuden bracht (Wollust in dem Mai die Zeit hat Freude gebracht),34
BR_1574_I_n35,Was wóllen wir aber heben an (Was wollen wir aber heben an),"D, Dij"
BR_1574_I_n36,Wach auff meines hertzen ein schóne Du Christenliche schar (Wache auf meines Herzens schöne du christliche Schar),Dij
BR_1574_I_n37,Wo sol ich mich hin keren ich thumes brúderlein (Wo soll ich mich hin kehren),Diij
BR_1574_I_n38,Wach auff mein hort vernimb mein wort (Wach auf mein Hort vernimm mein Wort),Diiij
BR_1574_I_n39,Ich het mich eines kalten Winters verzeret (Ich hatte mich eines kalten Winters verzehrt),Dv
BR_1574_I_n40,Im óbern dorff sind zwen newe Orden (Im oberen Dorf sind zwei neue Orden),Dv
BR_1574_I_n41,Ich stund an einem morgen (Ich stand an einem Morgen),41
BR_1574_I_n42,Was wóllen wir aber heben an (Was wollen wir aber heben an),42
BR_1574_I_n43,Die bulschafft hat sich wol bedacht (Die Buhlschaft hat sich wohl bedacht),43
BR_1574_I_n44,Es jagt ein Falcke zwey weisse Ermelein (Es jagte ein Falke zwei weiße Ermelein),44
BR_1574_I_n45,Ich bin durch Frewleins willen geritten so manchen tag (Ich bin durch Frauleins Willen geritten gar manchen Tag),E
BR_1574_I_n46,Von deinet wegen bin ich hie (Von deinetwegen bin ich hier),E
BR_1574_I_n47,Wolt ir hóren ein newes geleiß (Wollt ihr hören ein neues Geleis),Eij
BR_1574_I_n48,Ach Gott wem sol ichs klagen das hertze leyden meyn (Ach Gott wem soll ich es klagen),Eiij
BR_1574_I_n49,O lieber Gott das dein gebott so vbel wirt gehalten (O lieber Gott dass dein Gebot so übel wird gehalten),Eiij
BR_1574_I_n50,Ich kam mir zu einem tantz da ich das frewlein fandt (Ich kam mir zu einem Tantz da ich das Fräulein fand),Eiiij
BR_1574_I_n51,Mich erfrewet schónes lieb wenn ich dich sol aneschawen (Mich erfreut schönes Lieb wenn ich dich soll anschauen),Eiiij
BR_1574_I_n52,Es hat sich zu mir gesellet ein feines Frewelein (Es hat sich zu mir gesellt ein feines Fräulein),Ev
BR_1574_I_n53,Ich hóret ein Frewlein klagen fúrwar ein weiblich bildt (Ich hörte ein Fräulein klagen fürwahr ein weibliches Bild),Ev
BR_1574_I_n54,Junckfrewlein sol ich mit euch gan (Jungfräulein soll ich mit euch gehen),54
BR_1574_I_n55,Ker wider glúck mit frewden (Kehre wieder Glück mir Freuden),55
BR_1574_I_n56,Frólich so wil ich singen wol hewr (Fröhlich so will ich singen wohl heuer),56
BR_1574_I_n57,Fuchs wilt bin ich darumb sehne ich mich (Fuchs wild bin ich darum sehne ich mich),57
BR_1574_I_n58,Du hessigs glúck magst noch dein dúck (Du hässiges Glück magst doch deine Tücke),58
BR_1574_I_n59,Vnd nemet also vergut Ir lieben Bergkgesellen (das Ende dieser Bergreien Und venehmt also für gut ihr lieben Berggesellen),
Bs_WoSollIch1_n01,Wo sol ich mich hin ke[r]en [ich] iunges (Wo soll ich mich hin kehren),
Bs_WoSollIch2_n01,Wo soll ich mich hyn kóren (Wo soll ich mich hin kehren),
CH-Bu_F.X.1_D_n001,Ach frówli zart (Ach Fräulein zart),1r
CH-Bu_F.X.1_D_n002,Nit lang by nacht (Nicht lang bei Nacht),1v
CH-Bu_F.X.1_D_n003,Min hertz hat sich (Mein Herz hat sich mit Liebe verpflichtet),2r
CH-Bu_F.X.1_D_n004,Hertz liebstes bild (Herzliebstes Bild),2v
CH-Bu_F.X.1_D_n005,Frúntlich vnd milt (Freundlich und mild),3r-3v
CH-Bu_F.X.1_D_n006,Zucht er vnd lob ir wonet (Zucht Ehre und Lob),3v-4v
CH-Bu_F.X.1_D_n007,Frúntlicher grús (Freundlicher Gruß mit Buße),4v-5r
CH-Bu_F.X.1_D_n008,Ach gútter gsel (Ach guter Geselle),5r-5v
CH-Bu_F.X.1_D_n009,Cupido hat (Cupido hat ihm jetzt erdacht),5v-6v
CH-Bu_F.X.1_D_n010,Es wolt ein meitlin nussen gan (Es wollte ein Maidlein nussen gehen),6v-7r
CH-Bu_F.X.1_D_n011,Ach hóchster (Ach höchster Hort),7v-8r
CH-Bu_F.X.1_D_n012,Min freúd allein (Meine Freude allein),8r-8v
CH-Bu_F.X.1_D_n013,Ein júnckfrow pild (Einer Jungfrau Bild),9r-9v
CH-Bu_F.X.1_D_n014,Dich als mich selbs (Dich als mich selbst),9v-10r
CH-Bu_F.X.1_D_n015,ich séft vnd rúw (Ich seufze und klage),10v-11r
CH-Bu_F.X.1_D_n016,Núr nerrisch sin (Nur närrisch sein ist meine Manier),11r-11v
CH-Bu_F.X.1_D_n017,Ich hoff es sy fast (Ich hoffe es sei fast wohl möglich),12r-12v
CH-Bu_F.X.1_D_n018,Min múterlin ich bin vf der schúl gelege (Mütterlein ich bin auf der Schule),13r-13v
CH-Bu_F.X.1_D_n019,Ich stond an einem morgen (Ich stand an einem Morgen),14r-14v
CH-Bu_F.X.1_D_n020,Ich stond an einem morgen (Ich stand an einem Morgen),14v
CH-Bu_F.X.1_D_n021,Ich stond an einem morgen (Ich stand an einem Morgen),15r-15v
CH-Bu_F.X.1_D_n022,Ach elslin ach elslin wilt mit mir In die eret (Ach Elslein ach Elslein willst Du mit mir),15v-16r
CH-Bu_F.X.1_D_n023,Elslin liebes Elslein (Elslein),16r
CH-Bu_F.X.1_D_n024,Elsle liebes elselin (Elslein),16v
CH-Bu_F.X.1_D_n025,Lust mag myn hertz (Lust mag mein Herz),17r
CH-Bu_F.X.1_D_n026,Vnfal wann ist dyns wesen gnúg (Unfall wann ist deines Wesens genug),17v
CH-Bu_F.X.1_D_n027,Erst ist betriegt das hertze myn (Erst ist betrübt [?] das Herze mein*),18r
CH-Bu_F.X.1_D_n028,Großmechtig (Großmächtig),18v
CH-Bu_F.X.1_D_n029,Ein gmeiner prúch (Ein gemeiner Brauch(?)*),19r
CH-Bu_F.X.1_D_n030,Ach werde frúcht (Ach werte Frucht),19v
CH-Bu_F.X.1_D_n031,Meniger stelt nach gelt (Mancher stellt nach Geld),20r
CH-Bu_F.X.1_D_n032,Als ab vnd hin (Alles ab und hin),20v
CH-Bu_F.X.1_D_n033,Dich als mich selbs (Dich als mich selbst),21r
CH-Bu_F.X.1_D_n034,Auff glúck ich wart (Auf Glück ich warte),21v
CH-Bu_F.X.1_D_n035,Ich hoff der zit (Ich hoffe der Zeit),22r
CH-Bu_F.X.1_D_n036,Elslin (Elslein),22v
CH-Bu_F.X.1_D_n037,Hertzliches pild (Herzliches Bild),22v-23r
CH-Bu_F.X.1_D_n038,Endlin (**Ich hätte mir ein Endlein [Annelein?] für genommen),23v
CH-Bu_F.X.1_D_n039,Zart liepste frucht (Zart liebste Frucht),23v-24r
CH-Bu_F.X.1_D_n040,Kein ding auf erd (Kein Ding auf Erden),24v
CH-Bu_F.X.1_D_n041,Wol kúmpt der May (Wohl kommt der Mai),25r
CH-Bu_F.X.1_D_n042,Vil sorg ich trag (Viel Sorge ich trage),25v
CH-Bu_F.X.1_D_n043,Het ich in aller welt die wal (Hätte ich in aller Welt die Wahl),26r
CH-Bu_F.X.1_D_n044,Schwerlangweilig ist mir myn zyt (Schwer langweilig ist mir meine Zeit),26v
CH-Bu_F.X.1_D_n045,Elslin liepstes elselin myn wie geren wer ich py dir (Elslein),27r
CH-Bu_F.X.1_D_n046,Enzindt pin ich (Entzündet bin ich),27v
CH-Bu_F.X.1_D_n047,Crist ist erstanden (Christ ist erstanden),28r
CH-Bu_F.X.1_D_n048,Min glúck get vf der sitten uß (Mein Glück geht auf die Seite aus),28v
CH-Bu_F.X.1_D_n049,Elslin (Elslein),29r
CH-Bu_F.X.1_D_n050,O werder mund (O werter Mund),29r-30r
CH-Bu_F.X.1_D_n051,In mynem sinn (In meinem Sinn),30r-30v
CH-Bu_F.X.1_D_n052,In mynem sinn (In meinem Sinn),31r-31v
CH-Bu_F.X.1_D_n053,Ach hulff mich layd Ich arme metz (Ach hilf mich Leid),31v-32r
CH-Bu_F.X.1_D_n054,Offt wúnsch ich dir (Oft wünsche ich dir),32r-32v
CH-Bu_F.X.1_D_n055,Es wolt ein man versuchen sin wyb (Es wollte ein Mann versuchen sein Weib),33r
CH-Bu_F.X.1_D_n056,Kein frewd (Keine Freude habe ich auf Erd),33v
CH-Bu_F.X.1_D_n057,Was frewet mich (Was freuet mich das jetzund ich),34r
CH-Bu_F.X.1_D_n058,Ach hertzigs K (Ach herziges K),34v
CH-Bu_F.X.1_D_n059,Von erst so well wir loben (Von erst so wollen wir loben / Sixtus Dietrich),35r
CH-Bu_F.X.1_D_n060,Ellend pringt pin (Elend bringt Pein),35v
CH-Bu_F.X.1_D_n061,Ich seufftz vnd klag (Ich seufze und klage),36r
CH-Bu_F.X.1_D_n062,Nun griess dich got myn fine krot (Nun grüsse dich Gott meine feine Krot / Sixtus Dietrich),36v
CH-Bu_F.X.1_D_n063,Nun grieß dich got myn Drúselin (Nun grüße dich Gott mein Trusserlein / Sixtus Dietrich),37r
CH-Bu_F.X.1_D_n064,Ich stond an einem morgen (Ich stand an einem Morgen),37v-38r
CH-Bu_F.X.1_D_n065,Ergib mich der (Ergib mich der),38r
CH-Bu_F.X.1_D_n066,Ich stond an einem morgen (Ich stand an einem Morgen),38v
CH-Bu_F.X.1_D_n067,Recht zierlich lebt (Recht zierlich lebt),39r
CH-Bu_F.X.1_D_n068,Der welte fúnd (Der Welt Fund),39v
CH-Bu_F.X.1_D_n069,Eren werd vff erd (Ehrenwert auf Erd),40r
CH-Bu_F.X.1_D_n070,Was all myn tag erlitt myn hertz (Was alle meine Tage erlitt mein Herz),40r-40v
CH-Bu_F.X.1_D_n071,Nún merck ich wol (Nun merke ich wohl das ich nit soll),41r
CH-Bu_F.X.1_D_n072,Ach medlin ffein (Ach Maidlein rein ich habe allein),41v
CH-Bu_F.X.1_D_n073,Hoch wol gefallen (Hoch Wohlgefallen ist in mir das glaube du mir),42r
CH-Bu_F.X.1_D_n074,Hor zu von newen sachen (Höre zu von neuen Sachen),42v-43r
CH-Bu_F.X.1_D_n075,Ich weyss ein húpsche graserin (Ich weiß mir eine hübsche Graserin),43r
CH-Bu_F.X.1_D_n076,Mich wúndert ser (Mich wundert sehr je länger je mehr),43v-44r
CH-Bu_F.X.1_D_n077,Elsslin (Elslein),44r
CH-Bu_F.X.1_D_n078,Gross we ich lyd (Großes Weh ich leide),44v
CH-Bu_F.X.1_D_n079,On schertz myn hertz (Ohne Scherz mein Herz),45r
CH-Bu_F.X.1_D_n080,Nichts on vrsach (Nichts ohne Ursache),45v
CH-Bu_F.X.1_D_n081,Ach vnfal was zeichstú mich (Ach Unfall wessen zeihst du),46r
CH-Bu_F.X.1_D_n082,Wie wol vil hórter orden send (Wie wohl viel härtere Orden sind),56v
CH-Bu_F.X.1_D_n083,Zwen gesellen gút (Zwei Gesellen gut),47r
CH-Bu_F.X.1_D_n084,So gluck vnd stúnd (So Glück und Stunde),47v
CH-Bu_F.X.1_D_n085,Hab grossen danck (Habe großen Dank der Liebe dein),48r
CH-Bu_F.X.1_D_n086,Recht vrsach pringt (Rechte Ursache bringt),48v
CH-Bu_F.X.1_D_n087,Noch bin ich din (Noch bin ich dein),49r
CH-Bu_F.X.1_D_n088,Ach holdseligs medlin (Ach holdseliges Mädlein),49v
CH-Bu_F.X.1_D_n089,Parce domine (Parce domine populo tuo et ne des),50r
CH-Bu_F.X.1_D_n090,Patris sapientia veritas diuina (Patris sapientia veritas divina),50v
CH-Bu_F.X.1_D_n091,Patris sapientia veritas diuina (Patris sapientia veritas divina),51r
CH-Bu_F.X.1_D_n092,Domine fili (Domine fili),51v
CH-Bu_F.X.1_D_n093,Quinq (Quinque sequuntur),52r
CH-Bu_F.X.1_D_n094,Es taget vor dem walde stand vff keterlin (Es taget vor dem Walde),53r
CH-Bu_F.X.1_D_n095,Maria du pist genaden vol (Maria zart von edler art / Maria Du bist Gnaden voll),53v
CH-Bu_F.X.1_D_n096,Gottes namen faren wir (In Gottes Namen fahren wir),54r
CH-Bu_F.X.1_D_n097,Wann ich des morgens frie vff stond (Wenn ich des Morgens früh aufstehe),54v
CH-Bu_F.X.1_D_n098,Wolluf wir wóllens wecken (Wohlauf wir wollens wecken),55r
CH-Bu_F.X.1_D_n099,Ich armer man (Ich armer Mann),55v
CH-Bu_F.X.1_D_n100,Anfang minr lieb (Anfang meiner Liebe),56r
CH-Bu_F.X.1_D_n101,Vrsach zwingt mich (Ursache zwingt mich),56v
CH-Bu_F.X.1_D_n102,Vrsach zwingt mich (Ursache zwingt mich),57r
CH-Bu_F.X.1_D_n103,Du hertzigs myn fraw pin ich din (Frau bin ich dein du herziges mein),57v
CH-Bu_F.X.1_D_n104,Du hertzigs myn fraw pin ich din (Frau bin ich dein du herziges mein),58r
CH-Bu_F.X.1_D_n105,Crist ist erstanden (Christ ist erstanden),58v
CH-Bu_F.X.1_D_n106,Glúck Eer vnd gút (Glück Ehre und Gut),59r
CH-Bu_F.X.1_D_n107,Gedult vmb húld (Geduld um Huld),59v
CH-Bu_F.X.1_D_n108,Cela zons plus (Cela zons plus),59v-60r
CH-Bu_F.X.1_D_n109,Es taget vor dem walde (Es taget vor dem Walde),60v
CH-Bu_F.X.1_D_n110,Elslin liebstes elselin (Elslein),61r
CH-Bu_F.X.1_D_n111,Ich weis mir ein freye maget (Ich weiß mir eine freie Magd),61v
CH-Bu_F.X.1_D_n112,Ich weis mir ein freie maget (Ich weiß mir eine freie Magd),62r
CH-Bu_F.X.1_D_n113,Troplus secret (Trop plus secret que ma partie),62v
CH-Bu_F.X.1_D_n114,Tous les regres (Tous les regrets),63r
CH-Bu_F.X.1_D_n116,Tant que nostre argent (Tant que nôtre argent),64r
CH-Bu_F.X.1_D_n117,Mement (Mement),64v
CH-Bu_F.X.1_D_n118,Plus nultz regress (Plus mille regretz),64v-65r
CH-Bu_F.X.1_D_n119,Lome arme (L'homme armé),65v
CH-Bu_F.X.1_D_n120,Mons seul plasier (Mon seul plaisir),65v-66r
CH-Bu_F.X.1_D_n121,Adieu amours (Adieu amours),66v
CH-Bu_F.X.1_D_n122,Dentelore (Dentelore),67r
CH-Bu_F.X.1_D_n123,Fors seulement (Fors seulement),67v
CH-Bu_F.X.1_D_n124,Lordault (Lordault),68r
CH-Bu_F.X.2_A_n001,Ach frówlin zart (Ach Fräulein zart),1r-1v
CH-Bu_F.X.2_A_n002,Nit lang by nacht (Nicht lang bei Nacht),1v-2r
CH-Bu_F.X.2_A_n003,Min hertz hat (Mein Herz hat sich mit Liebe verpflichtet),2v-3r
CH-Bu_F.X.2_A_n004,Hertz liepstes (Herzliebstes Bild),3r-3v
CH-Bu_F.X.2_A_n005,Frúntlich vnd milt (Freundlich und mild),3v-4v
CH-Bu_F.X.2_A_n006,Zucht er vnd lob ir wonet (Zucht Ehre und Lob),4v-5r
CH-Bu_F.X.2_A_n007,Frúntlicher grúß mit búß (Freundlicher Gruß mit Buße),5v-6r
CH-Bu_F.X.2_A_n008,Ach gútter gsell (Ach guter Geselle),6r-6v
CH-Bu_F.X.2_A_n009,Cupido (Cupido hat ihm jetzt erdacht),6v-7r
CH-Bu_F.X.2_A_n010,Es wolt ein meitlin (Es wollte ein Maidlein nussen gehen),7r-7v
CH-Bu_F.X.2_A_n011,Ach hóchster hort (Ach höchster Hort),7v-8r
CH-Bu_F.X.2_A_n012,Min freúd allein (Meine Freude allein),8v-9r
CH-Bu_F.X.2_A_n013,Ein júnckfrow (Einer Jungfrau Bild),9r-9v
CH-Bu_F.X.2_A_n014,Mútterlin ich bin vff der púlschaft gewest (Mütterlein ich bin auf der Schule),10r-10v
CH-Bu_F.X.2_A_n015,Dich als mich (Dich als mich selbst),11r
CH-Bu_F.X.2_A_n016,Ich seúft vnd clag (Ich seufze und klage),11v-12r
CH-Bu_F.X.2_A_n017,Núr nerrisch sin (Nur närrisch sein ist meine Manier),12v-13r
CH-Bu_F.X.2_A_n018,Ich hoff es sy fast wol (Ich hoffe es sei fast wohl möglich),13r-14r
CH-Bu_F.X.2_A_n019,Ich stond an einem morgen (Ich stand an einem Morgen),15r
CH-Bu_F.X.2_A_n020,Ich stond an einem morgen (Ich stand an einem Morgen),15v
CH-Bu_F.X.2_A_n021,Ich stond an einem morgen (Ich stand an einem Morgen),16r
CH-Bu_F.X.2_A_n022,Ach elslin (Elslein),16v
CH-Bu_F.X.2_A_n023,Elslin liebstes elselin (Elslein),16v
CH-Bu_F.X.2_A_n024,Elslin liepstes elselin (Elslein),17r
CH-Bu_F.X.2_A_n025,Lust mag myn hertz (Lust mag mein Herz),17v
CH-Bu_F.X.2_A_n026,Vnfal wann ist dyns wesen genúg (Unfall wann ist deines Wesens genug),17v-18r
CH-Bu_F.X.2_A_n027,Erst ist betriegt das hertze myn (Erst ist betrübt [?] das Herze mein*),18v
CH-Bu_F.X.2_A_n028,Großmechtig (Großmächtig),19r
CH-Bu_F.X.2_A_n029,Ein gmeiner prúch (Ein gemeiner Brauch(?)*),19v
CH-Bu_F.X.2_A_n030,Ach werde frucht (Ach werte Frucht),20r
CH-Bu_F.X.2_A_n031,Meniger stelt nach gelt (Mancher stellt nach Geld),20v
CH-Bu_F.X.2_A_n032,Als ab vnd hin (Alles ab und hin),21r
CH-Bu_F.X.2_A_n033,Dich als mich selbs (Dich als mich selbst),21v
CH-Bu_F.X.2_A_n034,Aúff glúck ich wart (Auf Glück ich warte),22r
CH-Bu_F.X.2_A_n035,Ich hoff der zit (Ich hoffe der Zeit),22v
CH-Bu_F.X.2_A_n036,Elslin liepstes elselin (Elslein),23r
CH-Bu_F.X.2_A_n037,Hertzliches pild (Herzliches Bild),23r-23v
CH-Bu_F.X.2_A_n038,Zartliepste frúcht (Zart liebste Frucht),24r-24v
CH-Bu_F.X.2_A_n039,Endlin (**Ich hätte mir ein Endlein [Annelein?] für genommen),24v
CH-Bu_F.X.2_A_n040,Kein ding auf erd (Kein Ding auf Erden),25r
CH-Bu_F.X.2_A_n041,Wol kúmpt der May (Wohl kommt der Mai),25v
CH-Bu_F.X.2_A_n042,Vil sorg ich trag (Viel Sorge ich trage),26r
CH-Bu_F.X.2_A_n043,Het ich in aller welt die wal (Hätte ich in aller Welt die Wahl),26v
CH-Bu_F.X.2_A_n044,Schwerlangweilig ist mir myn zyt (Schwer langweilig ist mir meine Zeit),27r
CH-Bu_F.X.2_A_n045,Es taget vor dem walde (Es taget vor dem Walde),27v
CH-Bu_F.X.2_A_n046,Enzindt pin ich (Entzündet bin ich),28r
CH-Bu_F.X.2_A_n047,Crist ist erstanden (Christ ist erstanden),28v
CH-Bu_F.X.2_A_n048,Myn glúck gett vf der syten yß (Mein Glück geht auf die Seite aus),29r
CH-Bu_F.X.2_A_n049,Elslin liepstes elselin wie geren wer ich by dir (Elslein),29v
CH-Bu_F.X.2_A_n050,O werder mund (O werter Mund),29v-30r
CH-Bu_F.X.2_A_n051,In mynem sinn (In meinem Sinn),30v-31r
CH-Bu_F.X.2_A_n052,In mynem sinn (In meinem Sinn),31r-31v
CH-Bu_F.X.2_A_n053,Ach hulff mich leid (Ach hilf mich Leid),32r-32v
CH-Bu_F.X.2_A_n054,Oft wúnsch ich dir (Oft wünsche ich dir),32v-33r
CH-Bu_F.X.2_A_n055,Es wolt ein man versuchen sin wyb (Es wollte ein Mann versuchen sein Weib),33v
CH-Bu_F.X.2_A_n056,Kein frewd (Keine Freude habe ich auf Erd),34r
CH-Bu_F.X.2_A_n057,Was frewet mich (Was freuet mich das jetzund ich),34v
CH-Bu_F.X.2_A_n058,Ach hertzigs K (Ach herziges K),35r
CH-Bu_F.X.2_A_n059,Von erst so well wir loben (Von erst so wollen wir loben / Sixtus Dietrich),35v
CH-Bu_F.X.2_A_n060,Ellend pringt pin (Elend bringt Pein),36r
CH-Bu_F.X.2_A_n061,Ich seufftz vnd klag (Ich seufze und klage),36v
CH-Bu_F.X.2_A_n062,Nun griess dich got myn fine krot (Nun grüsse dich Gott meine feine Krot / Sixtus Dietrich),37r
CH-Bu_F.X.2_A_n063,Nun grieß dich got myn Drúselin (Nun grüße dich Gott mein Trusserlein),37v
CH-Bu_F.X.2_A_n064,Ich stond an einem morgen (Ich stand an einem Morgen),38r-38v
CH-Bu_F.X.2_A_n065,Ergib mich der (Ergib mich der),39r
CH-Bu_F.X.2_A_n066,Ich stond an einem morgen (Ich stand an einem Morgen),39v
CH-Bu_F.X.2_A_n067,Recht zierlich lebt (Recht zierlich lebt),40r
CH-Bu_F.X.2_A_n068,Der welte fúnd (Der Welt Fund),40v
CH-Bu_F.X.2_A_n069,Eren werd vff erd (Ehrenwert auf Erd),41r
CH-Bu_F.X.2_A_n070,Was all myn tag erlitt myn hertz (Was alle meine Tage erlitt mein Herz),41v
CH-Bu_F.X.2_A_n071,Nun merck ich wol (Nun merke ich wohl das ich nit soll),42r
CH-Bu_F.X.2_A_n072,Ach medlin Rein (Ach Maidlein rein ich habe allein),42v
CH-Bu_F.X.2_A_n073,Hoch wol gefallen (Hoch Wohlgefallen ist in mir das glaube du mir),43r
CH-Bu_F.X.2_A_n074,Hór zú von nuwen sachen (Höre zu von neuen Sachen),43v-44r
CH-Bu_F.X.2_A_n075,Ich weyss mir ein húpsche graserin (Ich weiß mir eine hübsche Graserin),44r
CH-Bu_F.X.2_A_n076,Mich wúndert ser (Mich wundert sehr je länger je mehr),44v-45r
CH-Bu_F.X.2_A_n077,Elsslin (Elslein),45r
CH-Bu_F.X.2_A_n078,Gross we ich lyd (Großes Weh ich leide),45v
CH-Bu_F.X.2_A_n079,On schertz (Ohne Scherz mein Herz),46r
CH-Bu_F.X.2_A_n080,Nichts on vrsach (Nichts ohne Ursache),46v
CH-Bu_F.X.2_A_n081,Ach vnfal was zeychstu mich (Ach Unfall wessen zeihst du),47r
CH-Bu_F.X.2_A_n082,Wie wol vil horter orden send (Wie wohl viel härtere Orden sind),47v
CH-Bu_F.X.2_A_n083,Zwen gsellen gút (Zwei Gesellen gut),48r
CH-Bu_F.X.2_A_n084,So gluck vnd stúnd (So Glück und Stunde),48v
CH-Bu_F.X.2_A_n085,Hab grossen danck (Habe großen Dank der Liebe dein),49r
CH-Bu_F.X.2_A_n086,Recht vrsach pringt (Rechte Ursache bringt),49v
CH-Bu_F.X.2_A_n087,Noch bin ich dein (Noch bin ich dein),50r
CH-Bu_F.X.2_A_n088,Ach holdseligs medlin (Ach holdseliges Mädlein),50v
CH-Bu_F.X.2_A_n089,Parce domine (Parce domine populo tuo et ne des),51r
CH-Bu_F.X.2_A_n090,Patris sapientia veritas diuina (Patris sapientia veritas divina),51v
CH-Bu_F.X.2_A_n091,Patris sapientia veritas diuina (Patris sapientia veritas divina),52r
