IDs,title,fol_or_p
D-HEu_cpg_343_n073,Ein zúchtiges biltt schon reich vnd mildt (Ein züchtiges Bild schön reich und mild),67v-68r
D-HEu_cpg_343_n074,Des spils ich gar khein glick nit hab (Des Spiels ich gar kein Glück nicht habe),68v-69r
D-HEu_cpg_343_n075,Zart schónes weib dein edler leib (Zartes schönes Weib),69v-70r
D-HEu_cpg_343_n076,Verschútt hab ich mein haber mueß (Verschüttet habe ich mein Habermus),70r-70v
D-HEu_cpg_343_n077,Ich weis mir ein blumlein bloe (Ich weiß mir ein Blümlein blau),70v-72r
D-HEu_cpg_343_n078,Gnadt vnd grúß hoff ich hertz aller liebste mein (Gnade und Gruß hoffe ich Herzallerliebste mein),72r-73r
D-HEu_cpg_343_n079,Zucht ehr vnnd lob ir wonet bey (Zucht Ehre und Lob),73r-73v
D-HEu_cpg_343_n080,Ich hoff es sey vast sher wol muglich (Ich hoffe es sei fast wohl möglich),73v-74r
D-HEu_cpg_343_n081,Kein lieb ohn leidt schwer ich ein eidt (Kein Lieb ohne Leid),74r-74v
D-HEu_cpg_343_n082,Nach willen dein (Nach Willen dein),74v-75r
D-HEu_cpg_343_n083,Rosina wo was dein gestalt (Rosina wo war deine Gestalt),75v-76r
D-HEu_cpg_343_n084,Ach gott ich klag dir meine nott (Ach Gott ich klage dir meine Not),76r-76v
D-HEu_cpg_343_n085,All mein gedenkh kher ich vnnd wenckh (All mein Gedenken),76v-77r
D-HEu_cpg_343_n086,Ich klag den tag vnnd alle stundt (Ich klage den Tag),77r-77v
D-HEu_cpg_343_n087,Der summer fert uns von hinnen (Der Sommer fährt uns von hinnen),77v-79r
D-HEu_cpg_343_n088,Schwer lankweylig ist mir mein zeit (Schwer langweilig ist mir meine Zeit),79r-79v
D-HEu_cpg_343_n089,Vil vntreu ist auff erden (Viel Untreue ist auf Erden),79v-80r
D-HEu_cpg_343_n090,Ann dich hatt sich gebunden (An dich hat sich gebunden),80r-81r
D-HEu_cpg_343_n091,Nach grúener farb mein hertz verlanngt (Nach grüner Farbe mein Herz verlangt),81r-82r
D-HEu_cpg_343_n092,Ach dú heimliches leiden wie krenkstu mich (Ach du heimliches Leiden),82r-82v
D-HEu_cpg_343_n093,Wils gott so geschichts (Will es Gott so geschieht es),82v-83v
D-HEu_cpg_343_n094,Gar herlich kam gegangen ein graff (Gar herrlich kam gegangen ein Graf),83v-84r
D-HEu_cpg_343_n095,Ich hab mein sach zúe Gott gestelt (Ich habe meine Sache zu Gott gestellt),84r
D-HEu_cpg_343_n096,Ich hab mein hertz zue friden gestelt (Ich habe mein Herz zufrieden gestellt),84r-85r
D-HEu_cpg_343_n097,Hertz einger trost vf erden (Herz einiger Trost auf Erden),85r-86r
D-HEu_cpg_343_n098,Glúckselig ist der tag (Glückselig ist der Tag),86r-87r
D-HEu_cpg_343_n099,Frolich bin ich auß hertzen grundt (Fröhlich bin ich aus Herzens Grund),87r-88v
D-HEu_cpg_343_n100,Ach hilf mich leid (Ach hilf mich Leid),88v-89r
D-HEu_cpg_343_n101,Ach got wie wee mir scheyden thút (Ach Gott wie weh mir Scheiden tut),89v-90r
D-HEu_cpg_343_n190,Wo soll ich mich hinkeren (Wo soll ich mich hin kehren),133v-134r
D-HEu_cpg_343_n195,Wo soll ich mich hinkheren ich armes waldbrüederlein (Wo soll ich mich hin kehren),137v-138r
D-KA_DonMus.Autogr._1_n1,Der Bentzennawer jnn Tanntz Weiss (Benzenauer),1r–1v
D-KA_DonMus.Autogr._1_n2,Der Bentzennawer gar gútt (Benzenauer),1v–2r
D-KA_DonMus.Autogr._1_n3,Der schwartz Knab Dantz weiss gefloriert (Schwarzknabe),2r–3v
D-KA_DonMus.Autogr._1_n4,Sannct Jacobs Danntz (Sant Jakob Tanz),3v–4r
D-KA_DonMus.Autogr._1_n5,Der schwartz Knab (Schwarzknabe),4r–4v
D-KA_DonMus.Autogr._1_n6,Volgt der Moristgers dantz (Moresca),4v–5r
D-KA_DonMus.Autogr._1_n7,Der Schwarmz Knab dantz weiss (Schwarzknabe),5r–6r
D-KA_DonMus.Autogr._1_n8,Der hoppen danntz darúff (Hüpftanz),6v
D-Lem_I.191_n00,[Fundamentum] ([Fundamentum]),1v-2r
D-Lem_I.191_n01,Der stadpfeyffer tancz (Stadtpfeiffer Tanz),3v-7r
D-Lem_I.191_n02,[Der stadpfeyffer tancz] der Trippel (Stadtpfeiffer Tanz),7v-9r
D-Lem_I.191_n03,Si ist meyn búll (Sie ist meine Buhle),9v-11r
D-Lem_I.191_n04,[untitled: fragment] ([untitled: fragment]),11r_2
D-Lem_I.191_n05,Ich het mir eyn anelein fúrgnommen (**Ich hätte mir ein Endlein [Annelein?] für genommen),11v-13r
D-Lem_I.191_n06,Ellsleyn libes elssley (Elslein),13v-15r
D-Lem_I.191_n07,Eyn Tancz (Tanz),15v-17r
D-Lem_I.191_n08,[Eyn Tancz] Der Trippel (Tanz),17v-19r
D-Lem_I.191_n09,Unser magdt kann aússdermassen (Unsere Magd kann aus der Maßen),19v-21r
D-Lem_I.191_n10,Nach wyllen deynn (Nach Willen dein),21v-24r
D-Lem_I.191_n11,Ach Lieb mit laidt: Ach lib mith leyth (Ach Liebe mit Leid),24v-27r
D-Lem_I.191_n12,Von edler arth (Von edler Art),27v-30r
D-Lem_I.191_n13,Zarth schone fraw (Zarte schöne Frau),30v-33r
D-Lem_I.191_n14,Meyn eyniges a (Mein einiges A),33v-36r
D-Lem_I.191_n15,Deyn múrren macht (Dein Murren macht),36v-38r
D-Lem_I.191_n16,Wo ich mith leyb (Wo ich mit Leib),38v-40r
D-Lem_I.191_n17,Prelúdiúm (Präludium),41r
D-Lem_I.191_n18,Eyn final (Final),41r
D-Lem_I.191_n19,Preambel (Präambel),41v-42r
D-Lem_I.191_n20,Zwe Prelúdia [Präludium 1] (Präludium),42v-43r
D-Lem_I.191_n21,Zwe Prelúdia [Präludium 2] (Präludium),42v-43r
D-Mbs_Mus.ms._1511c_n01,Aspicé P[rima] (Aspice Domine),1r
D-Mbs_Mus.ms._1511c_n02,Aspice .S[ecunda] (Aspice Domine),1v
D-Mbs_Mus.ms._1511c_n03,Aspice T[erzia] (Aspice Domine),2r
D-Mbs_Mus.ms._1511c_n04,"[Aspice, marginalia: Fragment] (Aspice Domine)",2r
D-Mbs_Mus.ms._1511c_n05,Aspice Quint (Aspice Domine),3r
D-Mbs_Mus.ms._1511c_n06,"[Aspice, score, transcription of the voc. original] (Aspice Domine)",3v-4r
D-Mbs_Mus.ms._1511c_n07,Aspice Q[aurte] (Aspice Domine),4v
D-Mbs_Mus.ms._1511c_n08,aspice Sept (Aspice Domine),5v
D-Mbs_Mus.ms._1511c_n09,[A]spice Septime (Aspice Domine),6r
D-Mbs_Mus.ms._1511c_n10,Aspice Otavo (Aspice Domine),6v
D-Mbs_Mus.ms._1511c_n11,"[Aspice, marginalia: Fragment] (Aspice Domine)",6v
D-Mbs_Mus.ms._1511c_n12,[untitled] ([untitled]),7r-7v
D-Mbs_Mus.ms._1511c_n13,[untitled] ([untitled]),8r-9v
D-Mbs_Mus.ms._1511c_n14,[untitled] ([untitled]),10r-11v
D-Mbs_Mus.ms._1511c_n15,Benedica[m] D[omi]n[u]s (Benedicam Dominus),12r-13v
D-Mbs_Mus.ms._1511c_n16,Aspice domine (Aspice Domine),13v-14r
D-Mbs_Mus.ms._1511c_n17,Quem dicunt homines (Quem dicunt homines),16r-17v
D-Mbs_Mus.ms._1511c_n18,Jay fait pour Vous Cent Mille pass (Jay fait pour vous mille pas),18r
D-Mbs_Mus.ms._1511c_n19,[untitled] ([untitled]),18v
D-Mbs_Mus.ms._1511c_n20,[untitled] ([untitled]),19r
D-Mbs_Mus.ms._1511d_n01,don vier se la (Dont vient cela),1r-1v
D-Mbs_Mus.ms._1511d_n02,par ton regard (Par ton regard),1v-2r
D-Mbs_Mus.ms._1511d_n03,"vignon vignette (Vignon, vignon, vignon, vignette)",2v-3r
D-Mbs_Mus.ms._1511d_n04,vos aue gran torto (Cest à grant tort),3r-3v
D-Mbs_Mus.ms._1511d_n05,Vng laboúreúr (Ung laboureur au premier chant),4r-4v
D-Mbs_Mus.ms._1511d_n06,martin menoit (Martin menait son porceau au marché),4v-5r
D-Mbs_Mus.ms._1511d_n07,or Viencavien (Or vien ça vien m'amye),5v-6r
D-Mbs_Mus.ms._1511d_n08,Si mon malheur .B.N. (Si mon malheur m'y continue),6v
D-Mbs_Mus.ms._1511d_n09,[untitled: fragment] ([untitled: fragment]),7r
D-Mbs_Mus.ms._1511d_n10,hau le bois (Hau le bois vignerons),7v
D-Mbs_Mus.ms._1511d_n11,Ce moy de May (Ce moys de may),8r-9r
D-Mbs_Mus.ms._1511d_n12,[Par ton regard] (Par ton regard),10r
D-Mbs_Mus.ms._1511d_n13,[Le content est riche] (Le content est riche en ce monde),10v-11r
D-Mbs_Mus.ms._1511d_n14,Plus mil Regres (Plus mille regretz / It's pretty good),11v-12v
D-Mbs_Mus.ms._1511d_n15,Bregantin da M Rosso (Bragantin*),14r
D-Mbs_Mus.ms._1511d_n16,Passa messo de M gregorio (Passamezzo),14r-14v
D-Mbs_Mus.ms._1511d_n17,Tenor de la traditora (La Traditora),15r
D-Mbs_Mus.ms._1511d_n18,la torca (*La torza [?]),15v
D-Mbs_Mus.ms._1511d_n19,Vn rezercar de 4. tono (Ricercare),16r-16v
D-Mbs_Mus.ms._1511d_n20,dagi la rocha al fússo (La rocha el fuso*),16v-17v
D-Mbs_Mus.ms._1511d_n21,Pass'é mezo (Passamezzo),18r-20r
D-Mbs_Mus.ms._1511d_n22,Padoana (Padoana),20v-21r
D-Mbs_Mus.ms._1511d_n23,Saltar[ello] (Saltarello),21v
D-Mbs_Mus.ms._1511d_n24,Re[cer]ca[r] (Ricercare),22r
D-Mbs_Mus.ms._1511d_n25,Re[cer]car (Ricercare / To the lonely and wise John),22v
D-Mbs_Mus.ms._1512_n000,"Anngefangen [...?] [...] [15]44, Lautenpuechl [15]33 (Anngefangen [...?] [...] [15]44, Lautenbüchlein [15]33)",0r
D-Mbs_Mus.ms._1512_n001,Der kragen aúf die Laútten (Der Kragen auf die Laute),1r
D-Mbs_Mus.ms._1512_n002,[untitled] ([untitled]),1r
D-Mbs_Mus.ms._1512_n003,Zú dem ersten wie man die Mensúr (Zu dem ersten wie man die Mensur),1v
D-Mbs_Mus.ms._1512_n004,Aúf ain lange noten (Auf eine lange Note),2r
D-Mbs_Mus.ms._1512_n005,Mein vleis vnd múe ich nie (Mein Fleiß und Mühe),3r
D-Mbs_Mus.ms._1512_n006,Ich clag den tag vnnd alle stúnd (Ich klage den Tag),3v
D-Mbs_Mus.ms._1512_n007,Es wolt ein maidlein wasser holn (Es wollte ein Maidlein Wasser holen),4r
D-Mbs_Mus.ms._1512_n008,Was wiert es doch (Was wird es noch des Wunders),4v-5r
D-Mbs_Mus.ms._1512_n009,Ein gúeter danntz [Hoftanz: Schwarz Knab] (Hoftanz),5v-6r
D-Mbs_Mus.ms._1512_n010,Der aúff vnd aúff (Auf und auf),6v-7r
D-Mbs_Mus.ms._1512_n011,Die prindlein die da fliessen (Die Brünnlein die da fliessen),7v-8r
D-Mbs_Mus.ms._1512_n012,Mein freúd allain (Meine Freude allein),8v
D-Mbs_Mus.ms._1512_n013,Vnnfall wan ist deins (Unfall wann ist deines Wesens genug),9r
D-Mbs_Mus.ms._1512_n014,Entlaúbet ist der walde (Entlaubt ist der Wald),9v
D-Mbs_Mus.ms._1512_n015,Der annder danntz [Hoftanz: Bayerisch Bot] (Hoftanz),10r
D-Mbs_Mus.ms._1512_n016,Der aúff vnd aúff (Auf und auf),10v
D-Mbs_Mus.ms._1512_n017,Mein selbs bin ich nit gwalltig Mer (Mein selbst bin ich nicht gewaltig),11r
D-Mbs_Mus.ms._1512_n018,Ich armes keútzlein klaine (Ich armes Käuzlein klein),11v
D-Mbs_Mus.ms._1512_n019,Ich waiss ein stolze Múllerinn (Ich weiß eine stolze Müllerin),12r
D-Mbs_Mus.ms._1512_n020,Ich armes Medlein (Ich armes Maidlein),12v
D-Mbs_Mus.ms._1512_n021,Der drit danntz (Tanz),13r
D-Mbs_Mus.ms._1512_n022,Der aúff vnd aúff (Auf und auf),13v
D-Mbs_Mus.ms._1512_n023,Amy súffre. Hie volgen dj frantzósisch stúkh (Amy souffrez),14r
D-Mbs_Mus.ms._1512_n024,DúbienscheLa F.[ranzosisch] S[tukh] (Dont vient cela),14v-15r
D-Mbs_Mus.ms._1512_n025,Longier me faút F.[ranzosisch] S[tukh] (Languir me fais),15v
D-Mbs_Mus.ms._1512_n026,Cesta grant tort (Cest à grant tort),16r
D-Mbs_Mus.ms._1512_n027,Ein preambl In Re (Präambel / red chalk),16v
D-Mbs_Mus.ms._1512_n028,Mein vleis vnnd múe (Mein Fleiß und Mühe),17r
D-Mbs_Mus.ms._1512_n029,Resonet in Laúdibús .I. pars (Resonet in laudibus),17v
D-Mbs_Mus.ms._1512_n030,Mein selbs bin ich nit gwalltig mer (Mein selbst bin ich nicht gewaltig),18r
D-Mbs_Mus.ms._1512_n031,Der Erst hoff danntz (Hoftanz),18v-19r
D-Mbs_Mus.ms._1512_n032,Der húpff aúff (Hupfauf),19v-20r
D-Mbs_Mus.ms._1512_n033,Ich clag den tag vnd alle stúndt (Ich klage den Tag),20v
D-Mbs_Mus.ms._1512_n034,Es wolt ein Maidlein wasser holenn (Es wollte ein Maidlein Wasser holen),21r
D-Mbs_Mus.ms._1512_n035,Was wiert es doch Des wúnders (Was wird es noch des Wunders),21v-22r
D-Mbs_Mus.ms._1512_n036,Die prindlein die da fliessen (Die Brünnlein die da fliessen),22v-23r
D-Mbs_Mus.ms._1512_n037,Der annder hoff danntz (Hoftanz),23v
D-Mbs_Mus.ms._1512_n038,Der húpff aúff (Hupfauf),24r
D-Mbs_Mus.ms._1512_n039,Unnfall wan ist deins wesens genúg (Unfall wann ist deines Wesens genug),24v-25r
D-Mbs_Mus.ms._1512_n040,Mein freúd allain (Meine Freude allein),25v-26r
D-Mbs_Mus.ms._1512_n041,Ich armes keútzlein klaine (Ich armes Käuzlein klein),26v
D-Mbs_Mus.ms._1512_n042,Erstanden ist der heilig Crisst (Erstanden ist der heilige Christ),27r
D-Mbs_Mus.ms._1512_n043,Erstanden ist der heilig Crisst. ain anders (Erstanden ist der heilige Christ),27v
D-Mbs_Mus.ms._1512_n044,Die Laútten ziéhen vnd Richten lernen (Die Lauten ziehen und Richten lernen),28r-28v
D-Mbs_Mus.ms._1512_n045,Die Saiten Lernen (Die Saiten lernen),28v
D-Mbs_Mus.ms._1512_n046,Ich wais ain stolze Múllerin (Ich weiß eine stolze Müllerin),29r
D-Mbs_Mus.ms._1512_n047,Ich Armes Medlein klag mich ser (Ich armes Maidlein klag mich sehr),29v-30r
D-Mbs_Mus.ms._1512_n048,Der dritt hoffdanntz (Hoftanz),30v
D-Mbs_Mus.ms._1512_n049,Der aúff vnnd aúf (Auf und auf),31r
D-Mbs_Mus.ms._1512_n050,Dúbiensche La franzosisch stukh (Dont vient cela),31v-32r
D-Mbs_Mus.ms._1512_n051,Amy súffre frantzosisch das ander stukh (Amy souffrez),32v-33r
D-Mbs_Mus.ms._1512_n052,Longier me faút F[rantzosisch] S[tukh] (Languir me fais / F[rantzosisch] S[tukh] / Französisches Stück / French piece of music),33v-34r
D-Mbs_Mus.ms._1512_n053,Cesta grant tort F.[rantzosisch] S.[tukh] (Cest à grant tort / F[rantzosisch] S[tukh] / Französisches Stück / French piece of music),34v-35r
D-Mbs_Mus.ms._1512_n054,Preambl Jn Re oder La Der Erst (Präambel),35v-36r
D-Mbs_Mus.ms._1512_n055,Preambl in sul In dem abzúg zuschlag[en]. Der and[er] (Präambel),36v-37r
D-Mbs_Mus.ms._1512_n056,Preambúlúm In Sol (Präambulum),37v-38r
D-Mbs_Mus.ms._1512_n057,Mein hertz hat sich mit Lieb verpflicht (Mein Herz hat sich mit Liebe verpflichtet),38v-39r
D-Mbs_Mus.ms._1512_n058,Jn gottes Namen faren wir. Triúm (In Gottes Namen fahren wir),39v-40r
D-Mbs_Mus.ms._1512_n059,Der Erst gstraifft danntz (Tanz mit Streichen),40v-41r
D-Mbs_Mus.ms._1512_n060,Ein gúet[er] gassenhaúer daraúff (Gassenhauer),41r
D-Mbs_Mus.ms._1512_n061,Der ander gstraifft danntz (Tanz mit Streichen),41v
D-Mbs_Mus.ms._1512_n062,Ein gúet[er] gassenhaúer daraúff (Gassenhauer),42r
D-Mbs_Mus.ms._1512_n063,Der dritt gstraifft danntz (Tanz mit Streichen),42v
D-Mbs_Mus.ms._1512_n064,Der Gassenhaúer daraúff (Gassenhauer),43r
D-Mbs_Mus.ms._1512_n065,Der Rúndt danntz (Runder Tanz),43v-44r
D-Mbs_Mus.ms._1512_n066,Gassenhaúer aúf den Rúndt danntz (Gassenhauer),44r
D-Mbs_Mus.ms._1512_n068,Der zeiner dantz (Zeiner Tanz),45v
D-Mbs_Mus.ms._1512_n069,Der aúf vnnd aúff (Auf und auf),46r
D-Mbs_Mus.ms._1512_n070,Der Marúscat danntz (Moresca),46v
D-Mbs_Mus.ms._1512_n071,Der aúff vnnd aúf (Auf und auf),47r
D-Mbs_Mus.ms._1512_n072,Ein ser gúet[er] danntz [Studenten Tanz] (Studenten Tanz),47v
D-Mbs_Mus.ms._1512_n073,Der aúf vnnd aúff (Auf und auf),48r
D-Mbs_Mus.ms._1512_n074,Danntz Medlein danntz (Tanz Maidlein tanz),48v
D-Mbs_Mus.ms._1512_n075,Der aúff vnnd aúff (Auf und auf),49r
D-Mbs_Mus.ms._1512_n076,Ein gúet[er] danntz der petler (Bettlertanz),49v
D-Mbs_Mus.ms._1512_n077,Der húpff aúff (Hupfauf),50r
D-Mbs_Mus.ms._1512_n078,Ein vast gúet[er] danntz. Wil niemant sing[en] so sing (Tanz),50v
D-Mbs_Mus.ms._1512_n079,Der aúf vnnd aúff (Auf und auf),51r
D-Mbs_Mus.ms._1512_n080,Der fúrstin paúren danntz (Der Fürstin Bauern Tanz),51v-52r
D-Mbs_Mus.ms._1512_n081,Der aúf vnnd aúff (Auf und auf),52v-53r
D-Mbs_Mus.ms._1512_n082,Der Erst Stat pfeiffer danntz (Stadtpfeiffer Tanz),53v-54r
D-Mbs_Mus.ms._1512_n083,Der húpff aúff (Hupfauf),54v-55r
D-Mbs_Mus.ms._1512_n084,Der and[er Stat pfeiffer Danntz (Stadtpfeiffer Tanz),55v-56r
D-Mbs_Mus.ms._1512_n085,Der húpff aúff (Hupfauf),56v
D-Mbs_Mus.ms._1512_n086,Der dritt Stat pfeiffer dantz (Stadtpfeiffer Tanz),57r
D-Mbs_Mus.ms._1512_n088,D'anntoboloigna (D'Antonio [da] Bologna[?]),58v
D-Mbs_Mus.ms._1512_n089,Saltarell (Saltarello),59r
D-Mbs_Mus.ms._1512_n090,Der annder Welsch danntz (Welscher Tanz),59v
D-Mbs_Mus.ms._1512_n091,Salltarell daraúff (Saltarello),60r
D-Mbs_Mus.ms._1512_n092,Der drit danntz Preseliner (Preseliner Tanz),60v
D-Mbs_Mus.ms._1512_n093,Madonna Trúsiana Preseliner (Madonna Trusiana Preseliner),61r
D-Mbs_Mus.ms._1512_n094,Der frantzosen danntz (Der Franzosen Tanz / red chalk),61v
D-Mbs_Mus.ms._1512_n095,Saltarell daraúf (Saltarello),62r
D-Mbs_Mus.ms._1512_n096,Ein behender Padúaner mit straiffen (Padoana),62v
D-Mbs_Mus.ms._1512_n097,Behenndt daraúf (Behände darauf),63r
D-Mbs_Mus.ms._1512_n098,Ein schoner Padúaner (Padoana),63v
D-Mbs_Mus.ms._1512_n099,Salltarell daraúff (Saltarello),64r
D-Mbs_Mus.ms._1512_n100,Rosina welscher danntz (Rossina welscher Tanz),64v
D-Mbs_Mus.ms._1512_n101,Rosina aúf vnd aúf (Rossina welscher Tanz),65r
D-Mbs_Mus.ms._1512_n102,Der kúnigin Welscher danntz (Welscher Tanz),65v-66r
D-Mbs_Mus.ms._1512_n103,Der Saltarell daraúf (Saltarello),66v
D-Mbs_Mus.ms._1512_n104,La bella Francisqina (La Francesci[a?]na*),67r
D-Mbs_Mus.ms._1512_n105,Der Erst welsch danntz (Welscher Tanz),67v
D-Mbs_Mus.ms._1512_n106,Der annder welsch tail zeschlagen (Welscher Tanz),68r
D-Mbs_Mus.ms._1512_n107,Der drit Welsch danntz (Welscher Tanz),68v
D-Mbs_Mus.ms._1512_n108,Ein welscher danntz der Erst teil (Welscher Tanz),69r
D-Mbs_Mus.ms._1512_n109,Der annder Welsch danntz (Welscher Tanz),69v
D-Mbs_Mus.ms._1512_n110,Der drit danntz La traditora (La Traditora),70r
D-Mbs_Mus.ms._1512_n111,Ein kind geporen zú Wethlehem (Ein Kind geboren zu Bethlehem),70v
D-Mbs_Mus.ms._1512_n112,Súnt impleta [p]r[im]a pars (Impleta sunt),71r-71v
D-Mbs_Mus.ms._1512_n113,Laß gros 1 herab (Lass groß 1 herab),72r
D-Mbs_Mus.ms._266_n015,Recercar del Marco de Laq[ui]la Zenza Canto (Ricercare),21r_1-5
D-Mbs_Mus.ms._266_n016,Recercar de M[arco]D[e] .LA.[quila] (Ricercare),21r_6-9
D-Mbs_Mus.ms._266_n017,[untitled] ([untitled]),21r_9-10
D-Mbs_Mus.ms._266_n018,Recircar de M.[arco] MD[e] .LA.[quila] (Ricercare),21v_1-3
D-Mbs_Mus.ms._266_n019,Recircar de M[arco] D[e] .LA.[quila] (Ricercare),21v_4-8
D-Mbs_Mus.ms._266_n020,[untitled] ([untitled]),21v_9-10
D-Mbs_Mus.ms._266_n021,Recercar de Franc[esc]o .de Milan (Ricercare),22r_1-5
D-Mbs_Mus.ms._266_n022,Re[cer]car M[arco]D[e] .LA.[quila] (Ricercare),22r_6-10
D-Mbs_Mus.ms._266_n023,Recercar de M.[arco] .MD[e] .Laq[ui]la (Ricercare),22v-23r
D-Mbs_Mus.ms._266_n024,Re[cer]car M[arco]D[e] .LA.[quila] (Ricercare),23v-24r
D-Mbs_Mus.ms._266_n025,Recircare de M.[arco] .MD[e] .Laquila (Ricercare),24v-25v
D-Mbs_Mus.ms._266_n026,Recircar de M.[arco] D[e] .Laq[ui]la (Ricercare),25v-26v
D-Mbs_Mus.ms._266_n027,[untitled] ([untitled]),26v_8-9
D-Mbs_Mus.ms._266_n028,Recircare de Marco de Laquila (Ricercare),27r
D-Mbs_Mus.ms._266_n029,[margin left: fragment] ([untitled: fragment]),27r_1
D-Mbs_Mus.ms._266_n030,[untitled] ([untitled]),27v_1-6
D-Mbs_Mus.ms._266_n031,Re[cer]car (Ricercare),27v_6-11
D-Mbs_Mus.ms._266_n032,Recercar (Ricercare),28r
D-Mbs_Mus.ms._266_n033,Re[cer]car de M[arco]D[e] LA.[quila] (Ricercare),28v_1-5
D-Mbs_Mus.ms._266_n034,[untitled] ([untitled]),28v_6-10
D-Mbs_Mus.ms._266_n035,Re[cer]car (Ricercare),29r_1-4
D-Mbs_Mus.ms._266_n036,Re[cer]car .Fran[ces]co. de Mil[an]o (Ricercare),29r_5-9
D-Mbs_Mus.ms._266_n037,[La Cara Cossa] (La Cara Cossa),30r_1-3
D-Mbs_Mus.ms._266_n038,[La Cara Cossa] (La Cara Cossa),30r_3-5
D-Mbs_Mus.ms._266_n039,[La Cara Cossa] (La Cara Cossa),30r_6-8
D-Mbs_Mus.ms._266_n040,[La Cara Cossa] (La Cara Cossa),30r_8-10
D-Mbs_Mus.ms._266_n041,[La Cara Cossa] (La Cara Cossa),30v_1-5
D-Mbs_Mus.ms._266_n042,[La Cara Cossa] (La Cara Cossa),30v_6-8
D-Mbs_Mus.ms._266_n043,[La Cara Cossa] (La Cara Cossa),30v_8-10
D-Mbs_Mus.ms._266_n044,[La Cara Cossa] (La Cara Cossa),31r_1-5
D-Mbs_Mus.ms._266_n045,[La Cara Cossa] (La Cara Cossa),31r_5-8
D-Mbs_Mus.ms._266_n046,[La Cara Cossa] (La Cara Cossa),31r_9-31v_6
D-Mbs_Mus.ms._266_n047,[La Cara Cossa] (La Cara Cossa),31v_7-9
D-Mbs_Mus.ms._266_n049,La traditora (La Traditora),33r_1-3
D-Mbs_Mus.ms._266_n050,De la traditora (La Traditora),33r_4-10
D-Mbs_Mus.ms._266_n051,de la traditora M[arco]D[e] .La[quila] (La Traditora),33v_1-6
D-Mbs_Mus.ms._266_n052,Tenor de la traditora (La Traditora),33v_7-10
D-Mbs_Mus.ms._266_n053,So[p?]ran de la traditora (La Traditora),34r_1-4
D-Mbs_Mus.ms._266_n054,Done impresteme il vostro borato .a Capite. No 1 (Donne impresteme il vostro burato),35r_1-2
D-Mbs_Mus.ms._266_n055,Done imprestene il vostro burato da buratare la mia farina (Donne impresteme il vostro burato),35r_3-5
D-Mbs_Mus.ms._266_n056,el So[p?]ran Bernardo non puol stare (Bernardo non puol stare*[?]),35v_1-3
D-Mbs_Mus.ms._266_n057,Tenor Bernarde no puol Stare (Bernardo non puol stare*[?]),35v_4-5
D-Mbs_Mus.ms._266_n058,Tocha tocha la Canella (La canella*),36r_1-5
D-Mbs_Mus.ms._266_n059,[untitled] ([untitled]),36r_6-8
D-Mbs_Mus.ms._266_n060,"Ti partti chuor mio charo (Ti parti, cor mio caro)",36r_9-10
D-Mbs_Mus.ms._266_n061,Pomo (Pomo*[?]),36v_1-3
D-Mbs_Mus.ms._266_n062,Marchese [de] San L[utzo] (Marchese de San Lutzo),36v_4-5
D-Mbs_Mus.ms._266_n063,Chanalcha (Chanalcha*[?]),36v_6-9
D-Mbs_Mus.ms._266_n064,[untitled] ([untitled]),36v_10
D-Mbs_Mus.ms._266_n065,Pioverin (Pioverin*[?]),37r_1-3
D-Mbs_Mus.ms._266_n066,bragantin (Bragantin*),37r_4-6
D-Mbs_Mus.ms._266_n067,[untitled] ([untitled]),38r_1-6
D-Mbs_Mus.ms._266_n068,Recircare de Francesco (Ricercare),38r-38v
D-Mbs_Mus.ms._266_n069,[untitled] ([untitled]),38v_9-10
D-Mbs_Mus.ms._266_n070,[untitled] ([untitled]),39r-39v
D-Mbs_Mus.ms._266_n071,[untitled] ([untitled]),40r-40v_2
D-Mbs_Mus.ms._266_n072,[untitled] ([untitled]),40v_3-10
D-Mbs_Mus.ms._266_n073,Mille Regres (Mille regretz),41r
D-Mbs_Mus.ms._266_n074,Parille danit (Parille danit*[?]),41v
D-Mbs_Mus.ms._266_n075,Nisi Dominus Prima pars (Nisi Dominus),41v-42r
D-Mbs_Mus.ms._266_n076,Secunda pars Cum dederit (Cum dederit),42v-43r
D-Mbs_Mus.ms._266_n077,Was wirt es doch des wonders noch (Was wird es noch des Wunders),43r
D-Mbs_Mus.ms._266_n078,Il est iour (Il est jour),43v
D-Mbs_Mus.ms._266_n079,Chuor Languor (Chuor Languor**?),43v-44v
D-Mbs_Mus.ms._266_n080,Amy souffre de M[arco]D[e] .La.[quila] (Amy souffrez),44v
D-Mbs_Mus.ms._266_n081,l est b[el e] bon .M[arco]D[e Laquila] (Il est bel et bon),45r-45v
D-Mbs_Mus.ms._266_n082,Nous Bergiers. Da M marco [de Laquila] (Nous Bergiers*[?]),46r-46v
D-Mbs_Mus.ms._266_n083,La Bataglia da M marco da Laquila (La battaglia),46v-47v
D-Mbs_Mus.ms._266_n084,[untitled] ([untitled]),48r_1-7
D-Mbs_Mus.ms._266_n085,duna Cossa spagnola [hierher?] (La Cara Cossa),48r_8-10
D-Mbs_Mus.ms._266_n086,Recercar de M marco da Laquila .caro. A. H. HE (Ricercare),48v
D-Mbs_Mus.ms._266_n087,Recircar de M. M[ar]co da Laquila (Ricercare),48v-49r
D-Mbs_Mus.ms._266_n088,Rec[erc]ar D[e] M[arco] D[a] Laq[ui]la (Ricercare),49r_6-8
D-Mbs_Mus.ms._266_n089,Priambolo del M M[arco] d[a] Laq[ui]la (Präambulum),49r_9-10
D-Mbs_Mus.ms._266_n090,Las voulez vous que vne persone (Las voulez vous),51r
D-Mbs_Mus.ms._266_n091,A [la] ventura (A l'aventure),51r-51v
D-Mbs_Mus.ms._266_n092,Las que crains mon amy (Las que crains-tu),52r
D-Mbs_Mus.ms._266_n093,Dou[lce] mem[oyre] (Doulce mémoire),52r-52v
D-Mbs_Mus.ms._266_n094,Vanicre ne peu (Vaincre n'a peü le temps par sa rigueur),52v
D-Mbs_Mus.ms._266_n095,Si vne heure p[ar]fecte B[ernardo?] (Si ung oeuvre parfait),53r
D-Mbs_Mus.ms._266_n096,"Vous Vsurpe (Vous usurpez, dames, injustement)",53r
D-Mbs_Mus.ms._266_n097,Or[n?] dira ce que Vouldre (On en dira ce qu'on vouldra),53v
D-Mbs_Mus.ms._266_n098,Je n[ause] estre [contant] B[ernardo?] (Je n'ose être content),53v
D-Mbs_Mus.ms._266_n099,Content de vous (Content de vous**[?]),53v
D-Mbs_Mus.ms._266_n100,Je ne fais rien que requerir (Je ne fais rien que requerir),54r
D-Mbs_Mus.ms._266_n101,Contre Raison (Contre raison vous m'êtes fort étrange),54r-54v
D-Mbs_Mus.ms._266_n102,Vaincre ne peu. De M Bernardo (Vaincre n'a peü le temps par sa rigueur),54v
D-Mbs_Mus.ms._266_n103,Plus mil Regres (Plus mille regretz),55r-55v
D-Mbs_Mus.ms._266_n104,Dites san pour (Dictes sans peur ou l'ouy ou nenny),55v
D-Mbs_Mus.ms._266_n105,Voiant souffrir de M. Ber.[nar]do (Souffrir me convient*[?]),56r
D-Mbs_Mus.ms._266_n106,La [rousee] du [moys] de [may] (La rouse du moys),56r-56v
D-Mbs_Mus.ms._266_n107,Aupres de vous secre tement (Auprès de vous),56v-57r
D-Mbs_Mus.ms._266_n108,Mauldicte soit la mondaine Richesse (Mauldicte soit),57r-57v
D-Mbs_Mus.ms._266_n109,Si mon malheur. M Bernardo (Si mon malheur m'y continue),57v
D-Mbs_Mus.ms._266_n110,Content Desir de M Bernardo (Content desir qui cause ma douleur),58r
D-Mbs_Mus.ms._266_n111,Ce qui soloyt. Ber.[nar]do (Ce qui souloit en deux se despartir),58r-58v
D-Mbs_Mus.ms._266_n112,Quil vouildra Savoyr qui ie Suis (Qui vouldra sçavoir qui je suys),58v
D-Mbs_Mus.ms._266_n113,Cest a grand tort de M M[ar]co da Laquila (Cest à grant tort),58v-59r
D-Mbs_Mus.ms._266_n114,Maulgre moy (Maulgré moy vis),59r
D-Mbs_Mus.ms._266_n115,Amour me voyant sans tristesse (Amour me voyant sans tristesse),60r
D-Mbs_Mus.ms._266_n116,Jayme le ceur de mamye (Jayme le ceur de mamye**?),60v
D-Mbs_Mus.ms._266_n117,Sarra martin. De M Albert (Sarra martin*[?]),61r-61v
D-Mbs_Mus.ms._266_n118,Changer ne puys (Changer ne puis et aultre ne désire),61v
D-Mbs_Mus.ms._266_n119,Recircar da mo mco [Marco da Laquila?] (Ricercare),64r
D-Mbs_Mus.ms._266_n120,Laultre jour par Vng Matin (L'autre jour je vis par ung matin),64r
D-Mbs_Mus.ms._266_n121,[untitled: fragment] ([untitled: fragment]),64r_15
D-Mbs_Mus.ms._266_n122,[untitled: fragment] ([untitled: fragment]),64r_15
D-Mbs_Mus.ms._266_n123,[untitled] ([untitled]),65r
D-Mbs_Mus.ms._266_n124,[untitled] ([untitled]),66r
D-Mbs_Mus.ms._266_n187,[In?] [p]rincipio (In principio),113r-114r_1-5
D-Mbs_Mus.ms._266_n188,[untitled] ([untitled]),114r_6-8
D-Mbs_Mus.ms._266_n189,Le vechie (Le vechie*[?]),115r
D-Mbs_Mus.ms._266_n190,Le vechie (Le vechie*[?]),116r
D-Mbs_Mus.ms._266_n191,[O dolce vita mia] (O dolce vita mia),117r
D-Mbs_Mus.ms._266_n192,[margin top: fragment] ([untitled: fragment]),117r
D-Mbs_Mus.ms._266_n193,O dolce vitta mia di Adriano .a. 4. v. (O dolce vita mia),118r-118v
D-Mbs_Mus.ms._266_n194,Elisabeth Zacharie (Elisabeth Zacharie*[?]),119r
D-Mbs_Mus.ms._267_n019,Ung Jour passé avec colletté mes batoyé secretement (Ung jour passé avec Collette),28r
D-Mbs_Mus.ms._267_n020,Letaré et exultaré p[ri]mo (Letaré et exultaré*),28v-29r
D-Mbs_Mus.ms._267_n021,Frisque gaillart 1 (Gallarda),29v-30r
D-Mbs_Mus.ms._267_n022,Contre Raisor N° 2 (Contre raison vous m'êtes fort étrange),30v-31r
D-Mbs_Mus.ms._267_n023,Trop tost iay creuy prenant tel plaisir (Trop tost iay creu),31r
